timestamp,user_id,ip,belief,strategy,feedback,risk_profile
2025-07-30T22:03:35.793506,test_local_sync,127.0.0.1,I think AAPL will outperform the market over the next 6 months,"{""type"": ""call option"", ""expiration"": ""2025-08-16"", ""explanation"": ""Test explanation""}",good,moderate
2025-07-31T12:22:55.813656,anonymous,127.0.0.1,Tesla will beat earnings,Call Option,good,moderate
2025-07-31T13:11:38.576373,anonymous,127.0.0.1,tsla will beat earnings,Call Option,good,moderate
2025-07-31T13:27:37.077619,anonymous,127.0.0.1,"""I think TSLA will move a lot after earnings, but I’m not sure if it will go up or down.""",Call Option,bad,moderate
2025-07-31T19:21:50.061641,test_feedback_user,127.0.0.1,I think TSLA will double by next year,Buy 1 call option at 2x strike expiring in 12 months,good,moderate
2025-07-31T19:25:16.289987,test_feedback_user,127.0.0.1,I think TSLA will double by next year,Buy 1 call option at 2x strike expiring in 12 months,good,moderate
2025-08-02T13:17:06.956594,anonymous,127.0.0.1,"""I believe Microsoft will rally after their AI announcement next month",Call Option,good,moderate
2025-08-02T14:54:27.932615,anonymous,127.0.0.1,I want to 2x my money on NVDA this month,Call Option,bad,moderate
2025-08-02T16:33:48.257272,anonymous,127.0.0.1,TSLA WILL GO UP,Call Option,bad,moderate
2025-08-02T18:33:40.564527,anonymous,127.0.0.1,TSLA will go up after earnings,Call Option,good,moderate
2025-08-05T00:33:43.657766,anonymous,127.0.0.1,TSLA WILL GO UP,Call Option,good,moderate
2025-08-05T16:59:58.345134,qa_test_user,127.0.0.1,I think AAPL will beat earnings next week,"{""type"": ""Call Option"", ""trade_legs"": [{""action"": ""Buy to Open"", ""ticker"": ""AAPL"", ""option_type"": ""Call"", ""strike_price"": ""150""}], ""expiration"": ""2025-09-20"", ""target_return"": ""20%"", ""max_loss"": ""Premium Paid"", ""time_to_target"": ""2 weeks"", ""explanation"": ""This strategy profits if AAPL rises post-earnings and limits loss to premium paid.""}",good,moderate
2025-08-05T19:17:28.170874,,127.0.0.1,I think NVDA will rally 15% after earnings next week,"{""type"": ""Call Option"", ""trade_legs"": [{""action"": ""Buy to Open"", ""ticker"": ""NVDA"", ""option_type"": ""Call"", ""strike_price"": ""Current Market Price""}], ""expiration"": ""2025-09-20"", ""target_return"": ""15%"", ""max_loss"": ""Premium Paid"", ""time_to_target"": ""1 week"", ""explanation"": ""This strategy profits if NVDA rises post-earnings and limits loss to premium paid.""}",good,moderate
2025-08-05T19:38:38.380676,test_prebeta,127.0.0.1,I believe NVDA will rally 15% after earnings,"{""type"": ""Call Option"", ""trade_legs"": [{""action"": ""Buy to Open"", ""ticker"": ""NVDA"", ""option_type"": ""Call"", ""strike_price"": ""Current Market Price""}], ""expiration"": ""2025-09-20"", ""target_return"": ""15%"", ""max_loss"": ""Premium Paid"", ""time_to_target"": ""1 week"", ""explanation"": ""This strategy profits if NVDA rises post-earnings.""}",good,moderate
2025-08-05T19:50:59.705347,test_prebeta,127.0.0.1,I believe NVDA will rally 15% after earnings,Call Option,good,moderate
2025-08-05T23:56:29.377327,test_prebeta,127.0.0.1,I believe NVDA will rally 15% after earnings,"{""type"": ""Call Option"", ""trade_legs"": [{""action"": ""Buy to Open"", ""ticker"": ""NVDA"", ""option_type"": ""Call"", ""strike_price"": ""Current Market Price""}], ""expiration"": ""2025-09-20"", ""target_return"": ""15%"", ""max_loss"": ""Premium Paid"", ""time_to_target"": ""1 week"", ""explanation"": ""This strategy profits if NVDA rises post-earnings.""}",good,moderate
2025-08-06T00:07:52.882937,simulation_batch,127.0.0.1,I think AAPL will beat earnings next week,"{""type"": ""Call Option"", ""trade_legs"": [{""action"": ""Buy to Open"", ""ticker"": ""AAPL"", ""option_type"": ""Call"", ""strike_price"": ""150""}], ""expiration"": ""2025-09-20"", ""target_return"": ""20%"", ""max_loss"": ""Premium Paid"", ""time_to_target"": ""2 weeks"", ""explanation"": ""This strategy profits if AAPL rises post-earnings and limits loss to premium paid.""}",good,moderate
2025-08-06T00:08:03.680364,simulation_batch,127.0.0.1,Tesla stock is overvalued and will drop 10%,"{""type"": ""Put Option"", ""trade_legs"": [{""action"": ""Buy to Open"", ""ticker"": ""TSLA"", ""option_type"": ""Put"", ""strike_price"": ""Current Market Price""}], ""expiration"": ""2025-09-20"", ""target_return"": ""10%"", ""max_loss"": ""Premium Paid"", ""time_to_target"": ""2 weeks"", ""explanation"": ""This strategy profits if TSLA drops 10% and limits loss to premium paid.""}",good,moderate
2025-08-06T00:09:05.508149,simulation_batch,127.0.0.1,I think AAPL will beat earnings next week,"{""type"": ""Call Option"", ""trade_legs"": [{""action"": ""Buy to Open"", ""ticker"": ""AAPL"", ""option_type"": ""Call"", ""strike_price"": ""150""}], ""expiration"": ""2025-09-20"", ""target_return"": ""20%"", ""max_loss"": ""Premium Paid"", ""time_to_target"": ""2 weeks"", ""explanation"": ""This strategy profits if AAPL rises post-earnings and limits loss to premium paid.""}",good,moderate
2025-08-06T00:09:16.816307,simulation_batch,127.0.0.1,Tesla stock is overvalued and will drop 10%,"{""type"": ""Put Option"", ""trade_legs"": [{""action"": ""Buy to Open"", ""ticker"": ""TSLA"", ""option_type"": ""Put"", ""strike_price"": ""Current Market Price""}], ""expiration"": ""2025-09-20"", ""target_return"": ""10%"", ""max_loss"": ""Premium Paid"", ""time_to_target"": ""2 weeks"", ""explanation"": ""This strategy profits if TSLA drops by 10% and limits loss to premium paid.""}",good,moderate
2025-08-06T00:09:25.241856,simulation_batch,127.0.0.1,Gold will rise due to inflation,"{""type"": ""Call Option"", ""trade_legs"": [{""action"": ""Buy to Open"", ""ticker"": ""GLD"", ""option_type"": ""Call"", ""strike_price"": ""200""}], ""expiration"": ""2025-09-20"", ""target_return"": ""20%"", ""max_loss"": ""Premium Paid"", ""time_to_target"": ""2 weeks"", ""explanation"": ""This strategy profits if Gold rises due to inflation and limits loss to premium paid.""}",good,moderate
2025-08-06T00:09:34.253046,simulation_batch,127.0.0.1,The US dollar will weaken against the Euro,"{""type"": ""Forex Trade"", ""trade_legs"": [{""action"": ""Buy"", ""ticker"": ""EUR/USD"", ""option_type"": ""Spot"", ""strike_price"": ""Market Price""}], ""expiration"": ""2025-09-20"", ""target_return"": ""20%"", ""max_loss"": ""Initial Investment"", ""time_to_target"": ""Until Expiration"", ""explanation"": ""This strategy profits if the US dollar weakens against the Euro and limits loss to the initial investment.""}",good,moderate
2025-08-06T00:09:44.517611,simulation_batch,127.0.0.1,Bitcoin will double in 6 months,"{""type"": ""Call Option"", ""trade_legs"": [{""action"": ""Buy to Open"", ""ticker"": ""BTC"", ""option_type"": ""Call"", ""strike_price"": ""Current Market Price""}], ""expiration"": ""2025-08-16"", ""target_return"": ""100%"", ""max_loss"": ""Premium Paid"", ""time_to_target"": ""6 months"", ""explanation"": ""This strategy profits if Bitcoin doubles in 6 months and limits loss to premium paid.""}",good,moderate
2025-08-06T00:09:54.038593,simulation_batch,127.0.0.1,Oil prices are going to crash due to oversupply,"{""type"": ""Put Option"", ""trade_legs"": [{""action"": ""Buy to Open"", ""ticker"": ""OIL"", ""option_type"": ""Put"", ""strike_price"": ""50""}], ""expiration"": ""2025-09-20"", ""target_return"": ""20%"", ""max_loss"": ""Premium Paid"", ""time_to_target"": ""2 weeks"", ""explanation"": ""This strategy profits if OIL prices crash due to oversupply and limits loss to premium paid.""}",good,moderate
2025-08-06T00:10:03.088257,simulation_batch,127.0.0.1,The Fed will raise interest rates,"{""type"": ""Call Option"", ""trade_legs"": [{""action"": ""Buy to Open"", ""ticker"": ""TLT"", ""option_type"": ""Put"", ""strike_price"": ""140""}], ""expiration"": ""2025-09-20"", ""target_return"": ""20%"", ""max_loss"": ""Premium Paid"", ""time_to_target"": ""2 weeks"", ""explanation"": ""This strategy profits if TLT falls when interest rates rise and limits loss to premium paid.""}",good,moderate
2025-08-06T00:10:14.245103,simulation_batch,127.0.0.1,Healthcare stocks are undervalued right now,"{""type"": ""Call Option"", ""trade_legs"": [{""action"": ""Buy to Open"", ""ticker"": ""XLV"", ""option_type"": ""Call"", ""strike_price"": ""100""}], ""expiration"": ""2025-09-20"", ""target_return"": ""20%"", ""max_loss"": ""Premium Paid"", ""time_to_target"": ""2 weeks"", ""explanation"": ""This strategy profits if healthcare stocks rise due to being undervalued and limits loss to premium paid.""}",good,moderate
2025-08-06T00:10:35.591875,simulation_batch,127.0.0.1,NVIDIA will outperform after its next earnings,"{""type"": ""Call Option"", ""trade_legs"": [{""action"": ""Buy to Open"", ""ticker"": ""NVDA"", ""option_type"": ""Call"", ""strike_price"": ""TBD""}], ""expiration"": ""2025-08-16"", ""target_return"": ""20%"", ""max_loss"": ""Premium Paid"", ""time_to_target"": ""After next earnings"", ""explanation"": ""This strategy profits if NVIDIA rises post-earnings and limits loss to premium paid.""}",good,moderate
2025-08-07T11:06:08.616843,,127.0.0.1,hmmm idk maybe markets go sideways,"{""type"": ""iron condor"", ""source"": ""ml_model""}",good,moderate
2025-08-07T11:13:41.146834,,127.0.0.1,I think gold will stay flat for the next 6 months,"{""type"": ""iron condor"", ""source"": ""ml_model""}",good,moderate
2025-08-07T11:17:41.784666,,127.0.0.1,I think TSLA is going to pop 20% this month,"{""type"": ""long call"", ""source"": ""ml_model""}",good,moderate
2025-08-07T11:17:41.921029,,127.0.0.1,I expect AMZN to stay rangebound through earnings,"{""type"": ""iron condor"", ""source"": ""ml_model""}",good,moderate
2025-08-07T11:17:42.017671,,127.0.0.1,SPY is overbought and could fall 5%,"{""type"": ""long put"", ""source"": ""ml_model""}",good,moderate
2025-08-07T11:17:42.119057,,127.0.0.1,The Euro will strengthen against the dollar,"{""type"": ""long forex eur/usd"", ""source"": ""ml_model""}",good,moderate
2025-08-07T11:17:42.214171,,127.0.0.1,NVDA will collapse post-earnings,"{""type"": ""bear put spread"", ""source"": ""ml_model""}",good,moderate
2025-08-07T11:17:42.315538,,127.0.0.1,AAPL has upside momentum going into the iPhone release,"{""type"": ""bull call spread"", ""source"": ""ml_model""}",good,moderate
2025-08-07T11:17:42.417879,,127.0.0.1,ARKK probably won’t move much this week,"{""type"": ""iron condor"", ""source"": ""ml_model""}",good,moderate
2025-08-07T11:17:42.519964,,127.0.0.1,Gold is due for a rally,"{""type"": ""buy equity"", ""source"": ""ml_model""}",good,moderate
2025-08-07T11:17:42.650452,,127.0.0.1,Treasury yields are spiking — TLT should drop,"{""type"": ""long put"", ""source"": ""ml_model""}",good,moderate
2025-08-07T14:18:54.250204,logtest1,127.0.0.1,I think NVDA will dump after earnings,bear put spread,bad,moderate
2025-08-07T14:40:13.089451,logtest1,127.0.0.1,I think NVDA will dump after earnings,bear put spread,bad,moderate
2025-08-07T14:40:57.003745,logtest2,127.0.0.1,I think TSLA will soar after the Cybertruck news,bull call spread,good,high
2025-08-07T23:52:47.652449,chat_user,10.0.0.160,Tesla's going up,Call Option,bad,moderate
2025-08-08T00:12:24.191285,chat_user,10.0.0.160,Double my money on corn ,Call Option,bad,moderate
2025-08-08T00:20:13.232967,chat_user,10.0.0.160,Corn demand will go up,Call Option,bad,moderate
2025-08-08T18:05:30.335091,chat_user,10.0.0.160,Need a bond ladder for steady growrh,Bond Ladder,good,moderate
2025-08-09T00:28:10.730035,chat_user,10.0.0.160,Idk which way oil prices are going,Straddle,bad,moderate
2025-08-09T16:47:08.427990,chat_user,127.0.0.1,tsla is going up ,Call Option,good,moderate
2025-08-09T17:35:27.065304,chat_user,10.0.0.160,I think housing will stay flat untill summer of next year,Real Estate Investment Trust,good,moderate
2025-08-10T17:31:04.594866,chat_user,127.0.0.1,i want a moderate growth bond ladder ,Bond Ladder,good,moderate
2025-08-10T19:50:08.155672,chat_user,127.0.0.1,soda in america has skyrocketed,Call Option,good,moderate
2025-08-11T23:52:13.260566,,127.0.0.1,I think AAPL will rally 15% over the next 3 months,Call Option,good,moderate
2025-08-12T01:05:50.214418,,127.0.0.1,I think AAPL will rally 15% over the next 3 months,Call Option,good,moderate
2025-08-12T01:06:21.623487,,127.0.0.1,I think NVDA will crash,Put Option,bad,moderate
2025-08-12T01:28:01.439593,,127.0.0.1,Tesla will crash 20%,Put Option,good,moderate
2025-08-12T20:27:48.045612,chat_user,127.0.0.1,LIQUOUR SALES WILL CONTINUE TO DECLINE FOR A LONG TIME,Put Option,good,moderate
2025-08-13T21:01:27.543548,elite_chat_user,127.0.0.1,how can i moderatly grow my money at roughly 10% per annum,Diversified Portfolio,bad,moderate
2025-08-13T23:41:50.112736,elite_chat_user,10.0.0.160,Corn demand is going up in Europe s,Futures Contract,bad,moderate
2025-08-15T00:27:08.085437,elite_chat_user,127.0.0.1,potato demand is rising in Europe,Commodity Futures,bad,moderate
2025-08-15T00:48:39.422733,elite_chat_user,127.0.0.1,Potato demand is going up in europe,Commodity Futures,good,moderate
2025-08-17T00:17:04.374427,elite_chat_user,127.0.0.1,Tesla will hit 300,Long Position,bad,moderate
2025-08-17T02:26:32.394742,elite_chat_user,127.0.0.1,Apple will rise 15%,Call Option,bad,moderate
2025-08-17T02:26:34.314726,elite_chat_user,127.0.0.1,Apple will rise 15%,Call Option,bad,moderate
2025-08-17T03:44:28.698201,elite_chat_user,127.0.0.1,tsla will beat earnings,Long Call Spread,bad,moderate
2025-08-17T04:07:12.427051,elite_chat_user,127.0.0.1,tsla will beat earnings,Bond Ladder,good,moderate
2025-08-17T13:15:47.298458,elite_chat_user,127.0.0.1,shortage of cattle will cause an increase in demand for dairy,Call Option,bad,moderate
2025-08-23T20:58:40.528175,elite_chat_user,127.0.0.1,tsla will go up ,Call Option,bad,moderate
2025-08-23T22:03:24.373798,elite_chat_user,127.0.0.1,tsla will go up ,Vertical Call Spread,bad,moderate
2025-08-23T23:15:04.928848,elite_chat_user,127.0.0.1,in theater sales will go up soon,Call Option,bad,moderate
2025-08-26T06:18:37.113563,elite_chat_user,127.0.0.1,electricity demand is going to go up towards the end of 2025,Call Option,bad,moderate
2025-08-26T06:18:41.137122,elite_chat_user,127.0.0.1,electricity demand is going to go up towards the end of 2025,Call Option,bad,moderate
2025-08-26T06:18:42.581835,elite_chat_user,127.0.0.1,electricity demand is going to go up towards the end of 2025,Call Option,bad,moderate
2025-08-26T06:18:43.113017,elite_chat_user,127.0.0.1,electricity demand is going to go up towards the end of 2025,Call Option,bad,moderate
2025-08-26T06:18:43.335561,elite_chat_user,127.0.0.1,electricity demand is going to go up towards the end of 2025,Call Option,bad,moderate
2025-08-26T06:18:43.552496,elite_chat_user,127.0.0.1,electricity demand is going to go up towards the end of 2025,Call Option,bad,moderate
2025-08-26T06:18:43.761131,elite_chat_user,127.0.0.1,electricity demand is going to go up towards the end of 2025,Call Option,bad,moderate
2025-08-26T06:18:43.998210,elite_chat_user,127.0.0.1,electricity demand is going to go up towards the end of 2025,Call Option,bad,moderate
2025-08-26T06:53:39.437934,elite_chat_user,10.0.0.160,Long term investment on aapl,Long Call Spread,good,moderate
2025-09-06T00:15:26.168596,elite_chat_user,127.0.0.1,tesla is going up after earnings,Call Option,bad,moderate
2025-09-06T17:25:59.091576,elite_chat_user,127.0.0.1,online clothing shopping is booming,Long Call Option,bad,moderate
2025-09-06T17:29:37.510051,elite_chat_user,127.0.0.1,online clothing shopping is booming,Long Straddle,bad,moderate
2025-09-06T17:29:47.708254,elite_chat_user,127.0.0.1,online clothing shopping is booming,Long Straddle,bad,moderate
2025-09-06T17:29:49.705905,elite_chat_user,127.0.0.1,online clothing shopping is booming,Long Straddle,bad,moderate
2025-09-06T17:35:36.995616,elite_chat_user,127.0.0.1,online clothing shopping is booming,Long Call Option,bad,moderate
2025-09-06T17:35:56.485033,elite_chat_user,127.0.0.1,online clothing shopping is booming,Long Straddle,bad,moderate
2025-09-06T17:40:32.825180,elite_chat_user,127.0.0.1,online clothing shopping is booming,Long Call Option,bad,moderate
2025-09-06T17:40:46.316296,elite_chat_user,127.0.0.1,online clothing shopping is booming,Long Straddle,bad,moderate
2025-09-06T17:42:31.336611,elite_chat_user,127.0.0.1,online clothing shopping is booming,Long Call Option,bad,moderate
2025-09-08T03:31:15.399890,elite_chat_user,127.0.0.1,oil demand is rising in europe,Straddle Option Strategy,bad,moderate
2025-09-10T15:20:32.629384,elite_chat_user,127.0.0.1,tesla will go up in the next two weeks by 20%,Bull Call Spread,bad,moderate
